{
  "summary": "已审计 2 个镜头，1 个可交付，1 个需要重试。",
  "succeeded": [
    {
      "shotId": "shot-001",
      "output": "outputs/shot-001.mp4"
    }
  ],
  "failed": [
    {
      "shotId": "shot-002",
      "reason": "角色在动作中失去已批准的服装特征，质量门未通过。"
    }
  ],
  "retrySuggestions": [
    {
      "shotId": "shot-002",
      "suggestion": "保留当前剧情与运镜，只加强角色服装参考的身份绑定。"
    }
  ],
  "exportManifest": [
    {
      "shotId": "shot-001",
      "file": "outputs/shot-001.mp4",
      "status": "ready"
    },
    {
      "shotId": "shot-002",
      "file": "outputs/shot-002.mp4",
      "status": "failed"
    }
  ]
}
